{
  "$schema": "../schemas/experiment.schema.json",
  "schema_version": "1.1.0",
  "id": "EXP-DC-F40-UV-001",
  "title": "Identify the active UV set without discarding alternatives",
  "domain": "DriveClub asset archaeology",
  "status": "planned",
  "question": "Which preserved UV stream best explains a selected material region under controlled texture tests?",
  "hypothesis": "One preserved UV stream will produce materially better texture continuity while the remaining streams retain distinct non-colour semantics.",
  "source_ids": ["EXT-DRIVECLUBFS", "EXT-010GAMETEMPLATES"],
  "assumptions": [
    "All available UV streams have been copied without remapping.",
    "The test texture and material assignment are known and fixed."
  ],
  "blender_versions": ["5.0.1"],
  "render_engines": ["Workbench", "Cycles"],
  "controlled_variables": {
    "mesh_revision": "example-only",
    "texture": "numbered UV test grid",
    "object_transform": "identity",
    "active_material_slot": "fixed"
  },
  "procedure": [
    "Import every preserved UV stream under a stable semantic name.",
    "Apply the same numbered test texture to each UV stream in isolation.",
    "Capture seam continuity, orientation, density, and out-of-range diagnostics.",
    "Retain all streams regardless of the selected material-facing result."
  ],
  "acceptance_criteria": [
    "The selected UV stream explains the target material region without destructive remapping.",
    "Alternative streams remain available and documented."
  ],
  "failure_criteria": [
    "No preserved stream produces coherent mapping.",
    "The result depends on an undocumented transform or manually repaired topology."
  ],
  "required_evidence_types": ["image", "mesh-report", "log"],
  "result": null,
  "decision": "pending",
  "supersedes": []
}
